{
  "schema": "axm.living-city.street-network/v0.9.0",
  "generatedFrom": {
    "seed": "AXM-WALKABLE-PLACES-EXAMPLE-090",
    "mapWidth": 18,
    "mapHeight": 13
  },
  "lanes": [
    {
      "id": "north_walk",
      "name": "Canal Backwalk",
      "y": 3.55,
      "color": "#8a9b94"
    },
    {
      "id": "main_street",
      "name": "Small Square Street",
      "y": 5.82,
      "color": "#b3a47d"
    },
    {
      "id": "old_lane",
      "name": "Old Lane",
      "y": 9.28,
      "color": "#9c866c"
    },
    {
      "id": "river_walk",
      "name": "River Edge Walk",
      "y": 12.28,
      "color": "#71959c"
    }
  ],
  "connectors": [
    {
      "id": "courtyard_cut",
      "name": "Courtyard Cut",
      "x": 2.75
    },
    {
      "id": "market_passage",
      "name": "Market Passage",
      "x": 8.9
    },
    {
      "id": "arcade_link",
      "name": "Arcade Link",
      "x": 15.45
    }
  ],
  "nodes": [
    {
      "id": "street_north_walk_0_35",
      "kind": "street",
      "streetId": "north_walk",
      "streetName": "Canal Backwalk",
      "x": 0.35,
      "y": 3.55
    },
    {
      "id": "street_north_walk_2",
      "kind": "street",
      "streetId": "north_walk",
      "streetName": "Canal Backwalk",
      "x": 2,
      "y": 3.55
    },
    {
      "id": "street_north_walk_2_75",
      "kind": "street",
      "streetId": "north_walk",
      "streetName": "Canal Backwalk",
      "x": 2.75,
      "y": 3.55
    },
    {
      "id": "street_north_walk_5",
      "kind": "street",
      "streetId": "north_walk",
      "streetName": "Canal Backwalk",
      "x": 5,
      "y": 3.55
    },
    {
      "id": "street_north_walk_7",
      "kind": "street",
      "streetId": "north_walk",
      "streetName": "Canal Backwalk",
      "x": 7,
      "y": 3.55
    },
    {
      "id": "street_north_walk_8",
      "kind": "street",
      "streetId": "north_walk",
      "streetName": "Canal Backwalk",
      "x": 8,
      "y": 3.55
    },
    {
      "id": "street_north_walk_8_9",
      "kind": "street",
      "streetId": "north_walk",
      "streetName": "Canal Backwalk",
      "x": 8.9,
      "y": 3.55
    },
    {
      "id": "street_north_walk_11",
      "kind": "street",
      "streetId": "north_walk",
      "streetName": "Canal Backwalk",
      "x": 11,
      "y": 3.55
    },
    {
      "id": "street_north_walk_14",
      "kind": "street",
      "streetId": "north_walk",
      "streetName": "Canal Backwalk",
      "x": 14,
      "y": 3.55
    },
    {
      "id": "street_north_walk_15_45",
      "kind": "street",
      "streetId": "north_walk",
      "streetName": "Canal Backwalk",
      "x": 15.45,
      "y": 3.55
    },
    {
      "id": "street_north_walk_16_5",
      "kind": "street",
      "streetId": "north_walk",
      "streetName": "Canal Backwalk",
      "x": 16.5,
      "y": 3.55
    },
    {
      "id": "street_north_walk_17_65",
      "kind": "street",
      "streetId": "north_walk",
      "streetName": "Canal Backwalk",
      "x": 17.65,
      "y": 3.55
    },
    {
      "id": "street_main_street_0_35",
      "kind": "street",
      "streetId": "main_street",
      "streetName": "Small Square Street",
      "x": 0.35,
      "y": 5.82
    },
    {
      "id": "street_main_street_2_75",
      "kind": "street",
      "streetId": "main_street",
      "streetName": "Small Square Street",
      "x": 2.75,
      "y": 5.82
    },
    {
      "id": "street_main_street_5",
      "kind": "street",
      "streetId": "main_street",
      "streetName": "Small Square Street",
      "x": 5,
      "y": 5.82
    },
    {
      "id": "street_main_street_6_5",
      "kind": "street",
      "streetId": "main_street",
      "streetName": "Small Square Street",
      "x": 6.5,
      "y": 5.82
    },
    {
      "id": "street_main_street_8_9",
      "kind": "street",
      "streetId": "main_street",
      "streetName": "Small Square Street",
      "x": 8.9,
      "y": 5.82
    },
    {
      "id": "street_main_street_9",
      "kind": "street",
      "streetId": "main_street",
      "streetName": "Small Square Street",
      "x": 9,
      "y": 5.82
    },
    {
      "id": "street_main_street_13_5",
      "kind": "street",
      "streetId": "main_street",
      "streetName": "Small Square Street",
      "x": 13.5,
      "y": 5.82
    },
    {
      "id": "street_main_street_15_45",
      "kind": "street",
      "streetId": "main_street",
      "streetName": "Small Square Street",
      "x": 15.45,
      "y": 5.82
    },
    {
      "id": "street_main_street_16_5",
      "kind": "street",
      "streetId": "main_street",
      "streetName": "Small Square Street",
      "x": 16.5,
      "y": 5.82
    },
    {
      "id": "street_main_street_17_65",
      "kind": "street",
      "streetId": "main_street",
      "streetName": "Small Square Street",
      "x": 17.65,
      "y": 5.82
    },
    {
      "id": "street_old_lane_0_35",
      "kind": "street",
      "streetId": "old_lane",
      "streetName": "Old Lane",
      "x": 0.35,
      "y": 9.28
    },
    {
      "id": "street_old_lane_2",
      "kind": "street",
      "streetId": "old_lane",
      "streetName": "Old Lane",
      "x": 2,
      "y": 9.28
    },
    {
      "id": "street_old_lane_2_75",
      "kind": "street",
      "streetId": "old_lane",
      "streetName": "Old Lane",
      "x": 2.75,
      "y": 9.28
    },
    {
      "id": "street_old_lane_5",
      "kind": "street",
      "streetId": "old_lane",
      "streetName": "Old Lane",
      "x": 5,
      "y": 9.28
    },
    {
      "id": "street_old_lane_8",
      "kind": "street",
      "streetId": "old_lane",
      "streetName": "Old Lane",
      "x": 8,
      "y": 9.28
    },
    {
      "id": "street_old_lane_8_9",
      "kind": "street",
      "streetId": "old_lane",
      "streetName": "Old Lane",
      "x": 8.9,
      "y": 9.28
    },
    {
      "id": "street_old_lane_9_5",
      "kind": "street",
      "streetId": "old_lane",
      "streetName": "Old Lane",
      "x": 9.5,
      "y": 9.28
    },
    {
      "id": "street_old_lane_12",
      "kind": "street",
      "streetId": "old_lane",
      "streetName": "Old Lane",
      "x": 12,
      "y": 9.28
    },
    {
      "id": "street_old_lane_15",
      "kind": "street",
      "streetId": "old_lane",
      "streetName": "Old Lane",
      "x": 15,
      "y": 9.28
    },
    {
      "id": "street_old_lane_15_45",
      "kind": "street",
      "streetId": "old_lane",
      "streetName": "Old Lane",
      "x": 15.45,
      "y": 9.28
    },
    {
      "id": "street_old_lane_16_5",
      "kind": "street",
      "streetId": "old_lane",
      "streetName": "Old Lane",
      "x": 16.5,
      "y": 9.28
    },
    {
      "id": "street_old_lane_17_65",
      "kind": "street",
      "streetId": "old_lane",
      "streetName": "Old Lane",
      "x": 17.65,
      "y": 9.28
    },
    {
      "id": "street_river_walk_0_35",
      "kind": "street",
      "streetId": "river_walk",
      "streetName": "River Edge Walk",
      "x": 0.35,
      "y": 12.28
    },
    {
      "id": "street_river_walk_2",
      "kind": "street",
      "streetId": "river_walk",
      "streetName": "River Edge Walk",
      "x": 2,
      "y": 12.28
    },
    {
      "id": "street_river_walk_2_75",
      "kind": "street",
      "streetId": "river_walk",
      "streetName": "River Edge Walk",
      "x": 2.75,
      "y": 12.28
    },
    {
      "id": "street_river_walk_6",
      "kind": "street",
      "streetId": "river_walk",
      "streetName": "River Edge Walk",
      "x": 6,
      "y": 12.28
    },
    {
      "id": "street_river_walk_8_9",
      "kind": "street",
      "streetId": "river_walk",
      "streetName": "River Edge Walk",
      "x": 8.9,
      "y": 12.28
    },
    {
      "id": "street_river_walk_11",
      "kind": "street",
      "streetId": "river_walk",
      "streetName": "River Edge Walk",
      "x": 11,
      "y": 12.28
    },
    {
      "id": "street_river_walk_15",
      "kind": "street",
      "streetId": "river_walk",
      "streetName": "River Edge Walk",
      "x": 15,
      "y": 12.28
    },
    {
      "id": "street_river_walk_15_45",
      "kind": "street",
      "streetId": "river_walk",
      "streetName": "River Edge Walk",
      "x": 15.45,
      "y": 12.28
    },
    {
      "id": "street_river_walk_16_5",
      "kind": "street",
      "streetId": "river_walk",
      "streetName": "River Edge Walk",
      "x": 16.5,
      "y": 12.28
    },
    {
      "id": "street_river_walk_17_65",
      "kind": "street",
      "streetId": "river_walk",
      "streetName": "River Edge Walk",
      "x": 17.65,
      "y": 12.28
    },
    {
      "id": "door_home_student",
      "kind": "door",
      "placeId": "home_student",
      "streetId": "north_walk",
      "streetName": "Canal Backwalk",
      "x": 2,
      "y": 3
    },
    {
      "id": "door_home_courtyard_1",
      "kind": "door",
      "placeId": "home_courtyard_1",
      "streetId": "north_walk",
      "streetName": "Canal Backwalk",
      "x": 5,
      "y": 3
    },
    {
      "id": "door_home_courtyard_2",
      "kind": "door",
      "placeId": "home_courtyard_2",
      "streetId": "north_walk",
      "streetName": "Canal Backwalk",
      "x": 7,
      "y": 3
    },
    {
      "id": "door_home_bakery_flat",
      "kind": "door",
      "placeId": "home_bakery_flat",
      "streetId": "north_walk",
      "streetName": "Canal Backwalk",
      "x": 11,
      "y": 3
    },
    {
      "id": "door_home_rooftop",
      "kind": "door",
      "placeId": "home_rooftop",
      "streetId": "north_walk",
      "streetName": "Canal Backwalk",
      "x": 14,
      "y": 3
    },
    {
      "id": "door_home_lane_1",
      "kind": "door",
      "placeId": "home_lane_1",
      "streetId": "old_lane",
      "streetName": "Old Lane",
      "x": 2,
      "y": 9
    },
    {
      "id": "door_home_lane_2",
      "kind": "door",
      "placeId": "home_lane_2",
      "streetId": "old_lane",